{
  "schema": "io.github.fixz.apkesu.theme-catalog",
  "version": 1,
  "generatedAt": 1792916524343,
  "categories": [
    {
      "id": "anime",
      "name": "动漫主题"
    }
  ],
  "themes": [
    {
      "id": "rikka-mix",
      "name": "六花混合",
      "author": {
        "id": "mocheng778",
        "name": "莫辰",
        "profileUrl": "https://github.com/Mocheng778",
        "avatarUrl": "https://raw.githubusercontent.com/fixz232/SterSU-ThemeStore/main/theme-store/assets/rikka-mix/v1/author.png",
        "bio": ""
      },
      "description": "以小鸟游六花为主的混合动漫主题，包含主页卡片、导航图标、页面背景与侧栏图片，使用侧栏小组件布局。",
      "category": "anime",
      "tags": [
        "六花",
        "混合",
        "动漫",
        "侧栏小组件"
      ],
      "versionCode": 1,
      "versionName": "1.0.0",
      "packageSchema": "io.github.fixz.apkesu.theme",
      "packageVersion": 7,
      "minManagerVersionCode": 33200,
      "maxManagerVersionCode": null,
      "coverUrl": "https://raw.githubusercontent.com/fixz232/SterSU-ThemeStore/main/theme-store/assets/rikka-mix/v1/cover.webp",
      "screenshots": [],
      "downloadUrl": "https://raw.githubusercontent.com/fixz232/SterSU-ThemeStore/main/theme-store/packages/rikka-mix/v1/rikka-mix-v1.kstheme",
      "sha256": "07b744820c6fcdd3abfc840312e8d6571085c686accddc03e2bd5ec6c2b3b936",
      "sizeBytes": 19307076,
      "license": "LicenseRef-All-Rights-Reserved",
      "changelog": "首次发布 v1.0.0。保留原始图片与主题设置，作者署名为“莫辰”，移除设备本地路径。",
      "publishedAt": 1792759651977,
      "status": "published",
      "featured": false,
      "downloadCount": 0
    },
    {
      "id": "shiroko-memory-horizon-dark",
      "name": "白子（暗色）",
      "author": {
        "id": "hyldhpx",
        "name": "回忆里的海平线",
        "profileUrl": "https://github.com/hyldhpx",
        "avatarUrl": "https://raw.githubusercontent.com/fixz232/SterSU-ThemeStore/main/theme-store/assets/shiroko-memory-horizon-dark/v1/author.png",
        "bio": ""
      },
      "description": "白子主题的暗色配色，包含全局壁纸、侧栏头像及主页状态卡片图片，适用于 miuix（美化版）。",
      "category": "anime",
      "tags": [
        "白子",
        "暗色",
        "侧栏",
        "miuix（美化版）"
      ],
      "versionCode": 1,
      "versionName": "beta0.0.1",
      "packageSchema": "io.github.fixz.apkesu.theme",
      "packageVersion": 7,
      "minManagerVersionCode": 33200,
      "maxManagerVersionCode": null,
      "coverUrl": "https://raw.githubusercontent.com/fixz232/SterSU-ThemeStore/main/theme-store/assets/shiroko-memory-horizon-dark/v1/cover.webp",
      "screenshots": [],
      "downloadUrl": "https://raw.githubusercontent.com/fixz232/SterSU-ThemeStore/main/theme-store/packages/shiroko-memory-horizon-dark/v1/shiroko-memory-horizon-dark-v1.kstheme",
      "sha256": "27d6988a69373a450fa22aa7747ec45989a4636a85de5376bae388be25c79159",
      "sizeBytes": 1229086,
      "license": "LicenseRef-All-Rights-Reserved",
      "changelog": "首次发布 beta0.0.1 暗色主题。保留原始侧栏、壁纸和状态卡片图片；移除作者真实姓名及设备本地路径。",
      "publishedAt": 1792758310119,
      "status": "published",
      "featured": false,
      "downloadCount": 0
    }
  ]
}
